Grant,Project,Collection,Archive URL,License,Collection short title,Collection title,Collection description,Project short title,Project title,Project description
U01 Yang,yang_MORF_confocal_proj,yang_MORF_confocal,http://download.brainimagelibrary.org/biccn/yang/morf/confocal/,CCBY4,Dendritome mapping,Dendritome mapping of genetically-defined and sparsely-labeled cortical and striatal projection neurons,"Imaging of mouse tissue labeled by Mosaicism with Repeat Frameshift (MORF), which enables sparsely and stochastically labeling of genetically-defined neurons in mice.",Dendritome mapping,Dendritome mapping of genetically-defined and sparsely-labeled cortical and striatal projection neurons,"Integrating molecular, morphological, and connectomic properties is critical for unbiased classification of neuronal cell types in the mammalian brain. Here we propose a novel approach to classify neuronal cell types by brainwide comprehensive profiling of the dendritic morphology of genetically-defined neurons in the mouse brain. We have developed an innovative mouse genetic tool, called Mosaicism with Repeat Frameshift (or MORF), which enables sparsely and stochastically labeling of genetically-defined neurons in mice. MORF reporter mice can label in exquisite detail single neurons from dendrite and spines to axons and axonal terminals at a labeling frequency of 1-5% of a given neuronal population. We propose to cross our new MORF lines with Cre mouse lines for striatal medium spiny neurons (MSNs) of direct- and indirect pathways, and for cortical pyramidal neurons of distinct cortical layers (i.e. L2/3/4, L5 and L6). Each MORF/Cre mouse will allow us to image the detailed dendritic morphology for thousands of genetically-defined striatal and cortical neurons (i.e. dendritome). We have also developed and streamlined imaging and computational tools to acquire and register brainwide single neuron morphological data onto a standard reference mouse brain atlas. We will digitally reconstruct hundreds of thousands of MORF-labeled neurons using our novel program called G-Cut. Reconstructed neurons will subsequently used for morphology based clustering to define new morphological subtypes, which in turn can be analyzed for the expression of novel molecular markers neuronal cell types (e.g. from single cell RNA-sequencing).  Finally, we will disseminate the data to the Brain Cell Data Center (BCDC) for data integration with those from other BRAIN Initiative Cell Census Network (BICCN) and for data access by the broader neuroscience research community. "
U01 ZhangKun,zhangK_snareseq,zhangK_cj_snareseq_R,,CCBY4,Marmoset RNA-seq,High-throughput sequencing of the transcriptome and accessible chromatin in the same cells of the Primary Motor Cortex,"~10,000 dual-omic data sets generated from 2 different marmoset MOp samples provided by Guoping Feng's group.",SNARE-seq ATAC-seq,High-throughput sequencing of the transcriptome and accessible chromatin in the same cells of the Primary Motor Cortex,"~10,000 dual-omic data sets genereted from 2 different marmoset MOp samples provided by Guoping Feng's group."
U01 ZhangKun,zhangK_snareseq,zhangK_hs_snareseq_AC,,CCBY4,Human ATAC-seq,High-throughput sequencing of the transcriptome and accessible chromatin in the same cells of the Primary Motor Cortex,"~90,000 dual-omic data sets of human primary motor cortex (MOp) SNARE-seq2 data sets that were generated using samples from 2 individuals provided by the Allen Brain Institute. ",SNARE-seq ATAC-seq,High-throughput sequencing of the transcriptome and accessible chromatin in the same cells of the Primary Motor Cortex,"~10,000 dual-omic data sets genereted from 2 different marmoset MOp samples provided by Guoping Feng's group."
U01 ZhangKun,zhangK_snareseq,zhangK_hs_snareseq_R,,CCBY4,Human RNA-seq,High-throughput sequencing of the transcriptome and accessible chromatin in the same cells of the Primary Motor Cortex,"~90,000 dual-omic data sets of human primary motor cortex (MOp) SNARE-seq2 data sets that were generated using samples from 2 individuals provided by the Allen Brain Institute. ",SNARE-seq ATAC-seq,High-throughput sequencing of the transcriptome and accessible chromatin in the same cells of the Primary Motor Cortex,"~10,000 dual-omic data sets genereted from 2 different marmoset MOp samples provided by Guoping Feng's group."
U01 ZhangKun,zhangK_snareseq,zhangK_cj_snareseq_AC,http://data.nemoarchive.org/biccn/grant/zhang/zhang/,CCBY4,Marmoset ATAC-seq,High-throughput sequencing of the transcriptome and accessible chromatin in the same cells of the Primary Motor Cortex,"~10,000 dual-omic data sets generated from 2 different marmoset MOp samples provided by Guoping Feng's group.",SNARE-seq ATAC-seq,High-throughput sequencing of the transcriptome and accessible chromatin in the same cells of the Primary Motor Cortex,"~10,000 dual-omic data sets genereted from 2 different marmoset MOp samples provided by Guoping Feng's group."
U01 ZhangLi,zhangl_anatomy_proj,zhangl_anatomy,,CCBY4,Brain-Spinal Cord Connectome - LSM,Cell Atlas of Mouse Brain-Spinal Cord Connectome using Light Sheet Microscopy,,Brain-Spinal Cord Connectome - LSM,Cell Atlas of Mouse Brain-Spinal Cord Connectome using Light Sheet Microscopy,
U01 ZhangLi,zhangl_seqfish_proj,zhangl_seqfish,http://download.brainimagelibrary.org/biccn/zhangl/seqfish/,CCBY4,Spinal cord connectome seqFish,Cell Atlas of Mouse Brain-Spinal Cord Connectome using seqFISH,Deep transcriptomic analysis of the mouse spinal cord.,Spinal cord connectome seqFish,Cell Atlas of Mouse Brain-Spinal Cord Connectome using seqFISH,Deep transcriptomic analysis of the mouse spinal cord.
U19 Ecker,ecker_sn_mCseq_retro_proj,ecker_sn_mCseq_retro,http://data.nemoarchive.org/biccn/grant/cemba/callaway/projection/,CCBY4,Methylation projection neurons,Regional DNA methylation profiling of individual projection neurons isolated from the mouse brain (RS2.1),Single nucleus DNA methylation data from cells labeled by retrograde tracers.,Methylation projection neurons,Regional DNA methylation profiling of individual projection neurons isolated from the mouse brain (RS2.1).,"The goal is to generate single nucleus methyl-C DNA sequence data from purified projection neurons from >100 neuronal circuits in the mouse brain. Recombinant AAV is injected bilaterally into selected brain regions in INTACT mice (B6.129-Gt(ROSA)26Sortm5(CAG-Sun1/sfGFP)Nat/MmbeJ animals in the C57BL/6 background, Jax stock #030952 @ two male and two female animals per injection site). Two weeks post AAV infection (P56), dissection of mouse brains follows the slice/region isolation protocol used in RS1. GFP-positive nuclei of projection neurons are isolated from the tissue segments pooled from selected anatomical regions that are known to project to the initial injection target, and subjected to single nuclei methyl-C DNA sequence analysis (snmC-seq2). Over 100 brain region pairings are analyzed from both male and female mice."
U19 Ecker,ecker_sn_mCseq_proj,ecker_sn_mCseq,http://data.nemoarchive.org/biccn/grant/cemba/ecker/methylation/,CCBY4,Methylation nuclei,DNA methylation profiling of genomic DNA in individual mouse brain cell nuclei (RS1.1),Single nucleus DNA methylation data.,Methylation nuclei,DNA methylation profiling of genomic DNA in individual mouse brain cell nuclei (RS1.1).,"The goal is to generate single nucleus methyl-C genomic DNA sequencing data from isolated cells from >100 regions of the mouse brain for both cell-type classification and the identification of regulatory elements. The brains of adult male C57BL/6J mice (P56) were sliced into 18 ? 600 micron thick coronal sections and tissues isolated from selected regions in each slice were pooled separately (6-30 animals per region, hemispheres combined). NeuN-positive and NeuN-negative cell nuclei were purified from each pool, and isolated nuclei subjected to single nuclei methyl-C DNA sequencing (snmC-seq2). (Note: The same tissue pools were used in both RS1.1 and RS1.2.) Over 100 selected brain regions were sampled across both brain hemispheres in male mice."
U19 Ecker,ecker_trio_proj,ecker_trio,http://download.brainimagelibrary.org/biccn/cemba/dong/TRIO/,CCBY4,TRIO tracing,Linking inputs to outputs of projection neurons within epigenetically defined regions in the mouse brain (RS2.2),Fluorescent imaging of brain tissue sections labeled by TRIO tracing using 3 different viruses.,TRIO tracing,Linking inputs to outputs of projection neurons within epigenetically defined regions in the mouse brain (RS2.2),"The goal is to link the epigenetic profiles of projection neurons to their monosynaptic inputs and distant outputs from >100 neuronal circuits in the mouse brain. TRIO experiments use 3 different viruses (AAVretro-Ef1a-Cre, AAV8-hSyn-FLEX- TVA-P2A-GFP-2A-oG helper virus, and EnvA pseudotyped G-deleted Rabies mCherry (EnvA RVdG-4mCherry). At the start of the experiment, AAVretro-Ef1a-Cre is injected unilaterally into structures that receive axons of target brain regions of interest. Two weeks post AAV infection (P70), injection of AAV helper virus and G-deleted rabies virus (AAV8hSyn-FLEX-TVA-P2A-GFP-2A-oG helper virus, EnvA RVdG-4mCherry) are made into the regions of interest. One week following the injection of AAV helper and rabies virus the brains are sectioned and imaged to visualize neuronal populations defined by their corresponding input and output profiles. The patterns of labeling across the whole brain are then reconstructed, quantified, and mapped to the Allen CCF and made available on www.mouseconnectome.org. This results in labeling, across the entire brain of neurons providing input to each projection cell type within epigenetically defined regions of interest. over 100 brain regions are analyzed for male mice."
U19 Ecker,ecker_sn_ATACseq_proj,ecker_sn_ATACseq,http://data.nemoarchive.org/biccn/grant/cemba/ecker/chromatin/,CCBY4,Chromatin accessibility,Chromatin accessibility profiling of genomic DNA in individual mouse brain cell nuclei (RS1.2),Single nucleus ATACseq chromatin accessibility data.,Chromatin accessibility,Chromatin accessibility profiling of genomic DNA in individual mouse brain cell nuclei (RS1.2).,"The goal is to profile open chromatin at single cell resolution using snATAC-seq across >100 mouse brain regions. The resulting profiles will be used to both define cell types and generate comprehensive catalogs of regulatory elements for each cell type. The brains of adult male C57BL/6J mice (P56) were sliced into 18 ? 600 micron thick coronal sections and tissues isolated from selected regions in each slice were pooled separately (6-30 animals per region, hemispheres combined). Pooled nuclei were subjected to tagged Tn5 transposon insertion to identify accessible chromatin (snATAC-seq). (Note: The same tissue pools were used in both RS1.1 and RS1.2.) Over 100 selected brain regions were sampled across both brain hemispheres in male mice."
U19 Huang,huang_stpt_count_proj,huang_stpt_count,http://download.brainimagelibrary.org/biccn/huang/cellcounting/,CCBY4,Serial two photon tomography,Projection Neuron subpopulation cell soma location and distribution,Serial two photon tomography of projection neuron subtypes labeled by transgenic strategies.,Serial two photon tomography,Projection Neuron subpopulation cell soma location and distribution,Serial two photon tomography of projection neuron subtypes labeled by transgenic strategies.
U19 Huang,huang_pn_proj,huang_pn_sn_10xv2,http://data.nemoarchive.org/biccn/grant/huang/arlotta/transcriptome/sncell/10x_v2/mouse/,CCBY4,Single nucleus 10xv2,Single nucleus transcriptomic profile of projection neuron subtypes in the mouse cortex,High-throughput single-nucleus RNA sequencing using 10x v2 of genetically labelled projection neuron (PN) populations of selected cortical regions.,Projection Neurons,Single nucleus transcriptomic profile of projection neuron subtypes in the mouse cortex,"Our goal is to create a high-resolution atlas of projection neurons in the mouse cortex using large scale single cell transcriptomic analysis across cortical regions.  CRE-driver lines targeting major cortical projection neuron subtypes and crossed to the Sun1-GFP nuclear reporter mouse line (C57 background) were used.  Samples representiung different cortical regions were dissected at p56. Individual nuclei were dissociated, sorted based on GFP labeling, and processed for single nuclei RNA sequencing using 10X Chromium V2. All regions sampled were obtained from both brain hemispheres in male and female mice. "
U19 Huang,huang_pn_proj,huang_pn_bulk_SSv4,http://data.nemoarchive.org/biccn/grant/huang/arlotta/transcriptome/bulk/SSv4/mouse/,CCBY4,Bulk nuclei SSv4,Transcriptomic profiling of bulk sorted nuclei from cortical projection neurons,SMART-seq v4 sequencing from bulk nuclei sorted from fluorescently labeled cortical projection neurons.,Projection Neurons,Single nucleus transcriptomic profile of projection neuron subtypes in the mouse cortex,"Our goal is to create a high-resolution atlas of projection neurons in the mouse cortex using large scale single cell transcriptomic analysis across cortical regions.  CRE-driver lines targeting major cortical projection neuron subtypes and crossed to the Sun1-GFP nuclear reporter mouse line (C57 background) were used.  Samples representiung different cortical regions were dissected at p56. Individual nuclei were dissociated, sorted based on GFP labeling, and processed for single nuclei RNA sequencing using 10X Chromium V2. All regions sampled were obtained from both brain hemispheres in male and female mice. "
U19 Huang,huang_retro_proj,huang_retro,http://download.brainimagelibrary.org/biccn/huang/dong/retrograde/quad/,CCBY4,Quadruple retrograde,Quadruple retrograde pathway tracing,Fluorescent imaging of brain tissue sections labeled by 4 retrograde tracers with nissl counterstain.,Quadruple retrograde,Quadruple retrograde pathway tracing,"Different populations of neurons can be defined by their unique connectivity characteristics. This information of connectional features can be integrated with additional discriminating elements of neurons like their molecular profile to provide more comprehensive cell identification. Retrograde pathway tracers identify the input connections of injected regions by labeling cell bodies. Male C57BL wild type mice 8 weeks of age were used. In one experiment, four retrograde tracers were injected in different regions of interest spanning the cortex, striatum, thalamus, amygdala, midbrain, or hindbrain. As such in one experiment, four different populations of neurons were identified simultaneously. All sections were counterstained with Nissl for cytoarchitectonic details."
U19 Huang,huang_sn_10xv2_proj,huang_sn_10xv2,http://data.nemoarchive.org/biccn/grant/huang/macosko_regev/transcriptome/sncell/10X_v2/mouse/,CCBY4,Single nucleus 10xv2,Transcriptomic cell types in the mouse brain: 10x nuclei (v2),Single nucleus profiling of cell types using 10X v2.,10x 3' v2 sequencing,Transcriptomic cell types in the mouse brain: 10x nuclei (v2),"Our goal is to create a high quality atlas of cell types in the mouse brain using large scale single cell transcriptomic analysis across the entire mouse brain. C57 wild-type mice at p60 were used. Dissections of frozen tissue were performed to obtain regions including neocortex, isocotex,substantia nigra, bed nucleus of the stria terminalis, cerebellum and hippocampus. Nuclei were sorted based on fluorescent DAPI staining of dissociated singlet nuclei and processed for single cell RNA sequencing using 10X Chromium V2.   All regions sampled were obtained from both brain hemispheres in male and female mice. "
U19 Huang,huang_sn_10xv2_proj,huang_sn_10xv3,http://data.nemoarchive.org/biccn/grant/huang/macosko_regev/transcriptome/sncell/10X_v3/mouse/,CCBY4,Single nucleus 10xv3,Transcriptomic cell types in the mouse brain: 10x nuclei (v2),Single nucleus profiling of cell types using 10X v3.,10x 3' v2 sequencing,Transcriptomic cell types in the mouse brain: 10x nuclei (v2),"Our goal is to create a high quality atlas of cell types in the mouse brain using large scale single cell transcriptomic analysis across the entire mouse brain. C57 wild-type mice at p60 were used. Dissections of frozen tissue were performed to obtain regions including neocortex, isocotex,substantia nigra, bed nucleus of the stria terminalis, cerebellum and hippocampus. Nuclei were sorted based on fluorescent DAPI staining of dissociated singlet nuclei and processed for single cell RNA sequencing using 10X Chromium V2.   All regions sampled were obtained from both brain hemispheres in male and female mice. "
U19 Huang,huang_stpt_conn_proj,huang_stpt_conn,http://download.brainimagelibrary.org/biccn/huang/connectivity/anterograde/,CCBY4,Anterograde tracing,Cre-dependent anterograde tracing in the forebrain,Serial two photon tomography of mouse brain labeled with fluorescent Cre-dependent anterograde tracing.,Anterograde tracing,Cre-dependent anterograde tracing in the forebrain,Serial two photon tomography of mouse brain labeled with fluorescent Cre-dependent anterograde tracing.
U19 Huang,huang_antero_proj,huang_antero,http://download.brainimagelibrary.org/biccn/huang/dong/anterograde/triple/,CCBY4,Anterograde tracing,Triple anterograde pathway tracing,Fluorescent imaging of brain tissue sections marked by anterograde tracer injections with nissl counterstain.,Anterograde tracing,Triple anterograde pathway tracing,"Different populations of neurons can be defined by their unique connectivity characteristics. This information of connectional features can be integrated with additional discriminating elements of neurons like their molecular profile to provide more comprehensive cell identification. Anterograde pathway tracers identify the output connections of injected regions by labeling axons, axon terminals, and boutons. Male C57BL wild type mice 8 weeks of age were used. In one experiment, three anterograde tracers were injected in different regions of interest spanning the cortex, striatum, thalamus, amygdala, midbrain, or hindbrain. As such in one experiment, the output of three different populations of neurons were traced simultaneously. All sections were counterstained with Nissl for cytoarchitectonic details."
U19 Zeng,zeng_tolias_pseq_proj,zeng_tolias_pseq_e,http://identifiers.org/DANDI:000008,CCBY4,Patch-seq Electrophysiology,Patch-seq of mouse motor cortex: electrophysiology,Patch-clamp electrophysiology recordings.,Patch-seq MOp,Patch-seq of mouse motor cortex: transcriptomics,"We used Patch-seq to combine patch-clamp recording, biocytin staining, and single-cell RNA sequencing of neurons in adult mouse motor cortex, providing a comprehensive morpho-electric annotation of almost all transcriptomically defined neural cell types."
U19 Zeng,zeng_tolias_pseq_proj,zeng_tolias_pseq_t,http://data.nemoarchive.org/biccn/grant/zeng/tolias/,CCBY4,Patch-seq Transcriptomics,Patch-seq of mouse motor cortex: transcriptomics,Transcriptomics from patched cells.,Patch-seq MOp,Patch-seq of mouse motor cortex: transcriptomics,"We used Patch-seq to combine patch-clamp recording, biocytin staining, and single-cell RNA sequencing of neurons in adult mouse motor cortex, providing a comprehensive morpho-electric annotation of almost all transcriptomically defined neural cell types."
U19 Zeng,zeng_tolias_pseq_proj,zeng_tolias_pseq_m,http://download.brainimagelibrary.org/biccn/zeng/tolias/pseq/morph/,CCBY4,Patch-seq Morphology,Patch-seq of mouse motor cortex: morphology,Morphological reconstructions.,Patch-seq MOp,Patch-seq of mouse motor cortex: transcriptomics,"We used Patch-seq to combine patch-clamp recording, biocytin staining, and single-cell RNA sequencing of neurons in adult mouse motor cortex, providing a comprehensive morpho-electric annotation of almost all transcriptomically defined neural cell types."
U19 Zeng,zeng_sn_SSv4_proj,zeng_sn_SSv4,http://data.nemoarchive.org/biccn/lab/zeng/transcriptome/sncell/SMARTer/,CCBY4,SMART-seq v4,Transcriptomic cell types in the mouse brain: SMART-seq nuclei,Single nucleus characterization in mouse brain using SMART-seq v4.,SMART-seq v4,Transcriptomic cell types in the mouse brain: SMART-seq nuclei,"Our goal is to create a high-quality atlas of cell types in the mouse brain using large scale single cell transcriptomic analysis across the entire mouse brain. Fine dissections of brain regions and layers were performed from both hemispheres of male and female mice. Nuclei were extracted from dissected tissues, and fluorescence activated sorting of nuclei was performed based on antibody labeling of NeuN protein to sort individual nuclei into separate wells. Isolated nuclei were processed for single nuclei RNA sequencing using SMARTer v4. This method enables tracking of dissection location and moderate gene detection per nucleus with accurate recovery of cell type proportions within (but not between) each tissue sample. This dataset surveys cells in the primary motor cortex (MOp) as well as regions where isolation of whole cells is difficult, or nuclear profiling is needed to establish cell type proportions."
U19 Zeng,TransgenicSTPT,zeng_expr_char,http://download.brainimagelibrary.org/biccn/zeng/expressioncharacterization/STPT/,AIBSTOU,Serial two photon tomography,Transgene Expression Data By Serial Two Photon Tomography,Serial two photon tomography of specific transgenic lines to support CCF annotation.,Transgenic STPT,Transgenic Characterization - serial two-photon tomography,"Transgene expression was used to label cell types and brain regions in mouse brain, and these transgenes were characterized using serial two-photon tomography to create 3D volumes. These data were used in conjunction with other multimodal reference data to parcellate the entire mouse brain into anatomic regions in order to create the Allen Mouse Brain Common Coordinate Framework (CCFv3), an annotated 3D reference space with 10µm voxel resolution."
U19 Zeng,zeng_sn_10x_proj,zeng_sn_10xv2,http://data.nemoarchive.org/biccn/lab/zeng/transcriptome/sncell/10X/,CCBY4,10x 3' v2 sequencing,Transcriptomic cell types in the mouse brain: 10x nuclei,Single nucleus characterization in mouse brain using 10x 3' v2 sequencing.,10x 3' v2 sequencing,Transcriptomic cell types in the mouse brain: 10x nuclei,"Our goal is to create a high-quality atlas of cell types in the mouse brain using large scale single cell transcriptomic analysis across the entire mouse brain. Coarse dissections of brain regions were performed and specimens were dissected from both hemispheres of male and female mice. Nuclei were extracted from dissected tissues, and fluorescence activated sorting of nuclei was performed based on antibody labeling of NeuN protein to obtains pools of nuclei enriched for neurons. These pools of nuclei were processed for single nucleus RNA sequencing using 10X Chromium v2, which isolated nuclei in droplets to assign individual nucleus barcodes. This method enables a rapid, large-scale survey of cell types in brain regions with accurate recovery of cell type proportions, but at low gene coverage per nucleus. This dataset surveys cells in the primary motor cortex (MOp) as well as regions where isolation of whole cells is difficult, or nuclear profiling is needed to establish cell type proportions."
U19 Zeng,zeng_sc_10x_proj,zeng_sc_10xv2,http://data.nemoarchive.org/biccn/lab/zeng/transcriptome/scell/10X/,CCBY4; AIBSTOU,10x 3' v2 sequencing,Transcriptomic cell types in the mouse brain: 10x v2 cells,Single cell characterization in mouse brain using 10x 3' v2 sequencing.,10x 3' sequencing,Transcriptomic cell types in the mouse brain: 10x cells,"Our goal is to create a high-quality atlas of cell types in the mouse brain using large scale single cell transcriptomic analysis across the entire mouse brain. Transgenic or viral strategies were used to label specific cell populations in the brain with fluorescent reporters. Sample collection was biased to enable sampling of as many cell types as possible and reduce redundant cell type collection. Most of the cells in this dataset were collected using broad Cre-driver lines that labeled all neurons (Snap25-IRES2-Cre), all Glutamatergic cells (Slc17a7-IRES2-Cre), or all GABAergic cells (Slc32a1-IRES-Cre or Gad2-IRES-Cre). Cells from primary visual cortex (VISp) and anterior lateral motor cortex (ALM, a subset of secondary motor cortex, MOs) were collected from a broad set of transgenic driver and reporter combinations in addition to the broad lines specified above. Fine dissections of brain regions and cortical layers were performed and tracked throughout sample processing. Specimens were dissected from both hemispheres in both male and female mice. Fluorescence activated s+J10orting of cells was performed based on expression or absence of fluorescent reporter labels to isolate individual cells into separate tubes. Isolated cells were processed for single cell RNA sequencing using SMARTer v4. This method enables tracking of dissection location and high gene detection per cell to identify fine differences in gene expression and highly selective marker genes. This dataset will survey all major regions of the mouse brain. Publication: Tasic, B. et al. Nature 563, 72;78 (2018)."
