Grant,Project,Collection,Archive URL,License,Collection short title,Collection title,Collection description,Project short title,Project title,Project description
RF1 Tasic,tasic_stpt_proj,tasic_stpt,,,STPT,Imaging of enhancer virus labeling,Serial two photon tomography characterizating fluorescent reporter expression from enhancer viruses in mouse brain.,STPT,Brain-wide labeling patterns of enhancer viruses,"Cell type-specific regulatory elements identified, AAV viruses were generated and delivered into the brains of reporter mice.  Virus-infected brains were imaged on a Tissuecyte 2P tomography system to characterize labeling patterns brain-wide."
RF1 Tasic,zeng_sc_SSv4_proj,zeng_sc_SSv4,http://data.nemoarchive.org/biccn/lab/tasic/transcriptome/scell/,CCBY4; AIBSTOU,SMART-seq v4,Transcriptomic cell types in the mouse brain: SMART-seq cells,Single cell characterization in mouse brain using SMART-seq v4.,SMART-seq v4,Transcriptomic cell types in the mouse brain: SMART-seq cells,"Our goal is to create a high-quality atlas of cell types in the mouse brain using large scale single cell transcriptomic analysis across the entire mouse brain. Transgenic or viral strategies were used to label specific cell populations in the brain with fluorescent reporters. Sample collection was biased to enable sampling of as many cell types as possible and reduce redundant cell type collection. Most of the cells in this dataset were collected using broad Cre-driver lines that labeled all neurons (Snap25-IRES2-Cre), all Glutamatergic cells (Slc17a7-IRES2-Cre), or all GABAergic cells (Slc32a1-IRES-Cre or Gad2-IRES-Cre). Cells from primary visual cortex (VISp) and anterior lateral motor cortex (ALM, a subset of secondary motor cortex, MOs) were collected from a broad set of transgenic driver and reporter combinations in addition to the broad lines specified above. Fine dissections of brain regions and cortical layers were performed and tracked throughout sample processing. Specimens were dissected from both hemispheres in both male and female mice. Fluorescence activated s+J10orting of cells was performed based on expression or absence of fluorescent reporter labels to isolate individual cells into separate tubes. Isolated cells were processed for single cell RNA sequencing using SMARTer v4. This method enables tracking of dissection location and high gene detection per cell to identify fine differences in gene expression and highly selective marker genes. This dataset will survey all major regions of the mouse brain. Publication: Tasic, B. et al. Nature 563, 72;78 (2018)."
RF1 Tasic,tasic_ATACseq_proj,tasic_ATACseq,http://data.nemoarchive.org/biccn/lab/tasic/chromatin/scell/,,ATACseq,Chromatin accessibility data from mouse V1,Single cell ATAC seq data from mouse V1.,ATACseq,Chromatin accessibility data from mouse V1,Chromatin accessibility data was collected from individual cells in mouse V1 and clustered with single cell data to identify enhancers specific for cell classes and subclasses.
U01 Dong,dong_antero_proj,dong_antero,http://download.brainimagelibrary.org/biccn/dong/anterograde/triple/,CCBY4,Anterograde tracing,Cre-dependent anterograde pathway tracing,Fluorescent imaging of brain tissue sections marked by Cre-dependent anterograde tracer injections with nissl counterstain.,Anterograde tracing,Cre-dependent anterograde pathway tracing,"Different populations of neurons can be defined by their unique connectivity profiles. To determine the brain-wide targets of projection-defined cell types (e.g., caudoputamen-projecting amygdala neurons), Cre-dependent anterograde tracing was used. Cre was delivered to a projection-defined population of neurons, whose outputs were then traced via a Cre-dependent anterograde tracer injection. Utilizing this strategy, the unique brain-wide connections of different projection-defined neurons can be attained (e.g., targets of caudoputamen-projecting amygdala neurons versus targets of hippocampus-projecting amygdala neurons). Male C57BL wild type mice 8 weeks of age were used and all sections were counterstained with Nissl for cytoarchitectonic details"
U01 Dong,dong_retro_proj,dong_retro,http://download.brainimagelibrary.org/biccn/dong/retrograde/,CCBY4,Retrograde tracing,Retrograde pathway tracing,Fluorescent imaging of brain tissue sections labeled by 3-5 retrograde tracers with nissl counterstain.,Retrograde tracing,Retrograde pathway tracing,"Different populations of neurons can be defined by their unique connectivity characteristics. This information of connectional features can be integrated with additional discriminating elements of neurons like their molecular profile to provide more comprehensive cell identification. Retrograde pathway tracers identify the input connections of injected regions by labeling cell bodies. Male C57BL wild type mice 8 weeks of age were used. In one experiment, 3-5 retrograde tracers were injected in different regions of interest spanning the cortex, striatum, thalamus, basal ganglia, hippocampus, amygdala, midbrain, or hindbrain. As such in one experiment, four different populations of neurons were identified simultaneously. All sections were counterstained with Nissl for cytoarchitectonic details."
U01 Dong,dong_trio_proj,dong_trio,http://download.brainimagelibrary.org/biccn/dong/trio/,CCBY4,TRIO,Tracing the relationship between input and output (TRIO),Fluorescent imaging of brain tissue sections labeled by Cre-dependent rabies viral tracers with nissl counterstain.,TRIO,Tracing the relationship between input and output (TRIO),"Different populations of neurons can be defined by their unique connectivity profiles. To determine the brain-wide inputs to projection-defined cell types (e.g., caudoputamen-projecting amygdala neurons), Cre-dependent rabies viral tracing was used. Cre was delivered to a projection-defined population of neurons, which received TVA and rabies glycoprotein delivered via a Cre-dependent helper virus. Next, an EnvA pseudotyped G-deleted rabies virus was delivered to the same population of neurons to label their monosynaptic inputs from cells across the brain (e.g., brain-wide inputs to caudoputamen-projecting amygdala neurons). Utilizing this strategy, the unique brain-wide monosynaptic inputs to different projection-defined cell types can be attained (e.g., inputs to caudoputamen-projecting amygdala neurons versus inputs to hippocampus-projecting amygdala neurons). Male C57BL wild type mice 8 weeks of age were used and all sections were counterstained with Nissl for cytoarchitectonic details."
U01 Ecker,ecker_hu_DNAseq_proj,ecker_hu_DNAseq,,CCBY4,DNA sequencing,DNA genome sequence of  individual human brain donors,DNA genome sequence of  individual human brain donors.,DNA sequencing,DNA genome sequence of  individual human brain donors,DNA genome sequence of  individual human brain donors
U01 Ecker,ecker_hu_sn_ATACseq_proj,ecker_hu_sn_ATACseq,,CCBY4,DNA methylation single cell,DNA methylation profiling of genomic DNA in individual human brain cell nuclei,DNA methylation profiling of genomic DNA in individual human brain cell nuclei.,DNA methylation single cell,DNA methylation profiling of genomic DNA in individual human brain cell nuclei,DNA methylation profiling of genomic DNA in individual human brain cell nuclei
U01 Ecker,ecker_hu_sn_mCseq_proj,ecker_hu_sn_mCseq,,CCBY4,Chromatin single cell,Chromatin accessibility profiling of genomic DNA in individual human brain nuclei,Chromatin accessibility profiling of genomic DNA in individual human brain nuclei.,Chromatin single cell,Chromatin accessibility profiling of genomic DNA in individual human brain nuclei,Chromatin accessibility profiling of genomic DNA in individual human brain nuclei
U01 Feng,feng_fish_proj,feng_fish,http://download.brainimagelibrary.org/biccn/feng/fish/,CCBY4,FISH,A Molecular and Cellular Atlas of the Marmoset Brain - FISH,Fluorescent in situ hybridization of sparsely labeled GFP cells across 16 brain regions.,FISH,A Molecular and Cellular Atlas of the Marmoset Brain - FISH,"By using Fluorescent In Situ Hybirdization techniques, we will profile the mRNA expression data of sparsely labeled GFP cells across 16 brain regions. This data will then be funneled through our semi-automatic tracing pipeline. The morphological and spatial data will be used to create an interactive atlas of the marmoset brain. "
U01 Feng,feng_sn_dropseq_proj,feng_sn_dropseq,http://data.nemoarchive.org/biccn/grant/feng/feng/transcriptome/scell/,CCBY4,Dropseq,A Molecular and Cellular Atlas of the Marmoset Brain - Dropseq,Single nucleus RNA sequencing of cells from marmoset brain.,Dropseq,A Molecular and Cellular Atlas of the Marmoset Brain - Dropseq,Single nucleus RNA sequencing of cells from marmoset brain.
U01 Fischl,fischl_oct_proj,fischl_oct,,,Volumetric OCT data,Serial sectioning block-face polarization sensitive optical coherence tomography of ex vivo human brain blocks,Volumetric OCT data collected from ex vivo human brain area BA 44/45 after index matching with 60% v/v TDE. Serial sectioning was performed with a slice thickness of 500 um. Block-face OCT acquisition was performed with a 4x objective with 5 um isotropic resolution. Each image tile has FOV of 3x3 mm2 and was stitched with adjacent image tiles during post-processing. The focal plane depth was shifted three times for each slice to cover the whole thickness of the 500um slice.,OCT,Serial sectioning block-face polarization sensitive optical coherence tomography of ex vivo human brain blocks,Volumetric OCT data collected from ex vivo human brain area BA 44/45 after index matching with 60% v/v TDE. Serial sectioning was performed with a slice thickness of 500 um. Block-face OCT acquisition was performed with a 4x objective with 5 um isotropic resolution. Each image tile has FOV of 3x3 mm2 and was stitched with adjacent image tiles during post-processing. The focal plane depth was shifted three times for each slice to cover the whole thickness of the 500um slice.
U01 Fischl,fischl_mri_proj,fischl_mri,,,MRI data of left hemisphere ,Multi-resolution structural and diffusion MRI for the ex vivo whole human hemisphere,Multi-resolution structural and diffusion MRI collected on ex vivo whole human hemispheres at field strengths of 3 T and 7 T. This dataset provides undistorted volumetric images of the human cerebral cortex to facilitate an MRI-based atlas coordinate system to which distorted histological cell typic can be registered.,MRI,Multi-resolution structural and diffusion MRI for the ex vivo whole human hemisphere,Multi-resolution structural and diffusion MRI collected on ex vivo whole human hemispheres at field strengths of 3 T and 7 T. This dataset provides undistorted volumetric images of the human cerebral cortex to facilitate an MRI-based atlas coordinate system to which distorted histological cell typic can be registered.
U01 Kriegstein,kriegstein_sc_ATACseq_proj,kriegstein_sc_ATACseq,,CCBY4,Single cell ATAC-seq,Single-Cell ATAC-seq of the Developing Human Brain,"Chromatin accessibility of >75,000 cells from eight distinct areas of developing human forebrain using single cell ATAC-seq (scATACseq).",Single cell ATAC-seq,Single-Cell ATAC-seq of the Developing Human Brain,"Dynamic changes in chromatin accessibility coincide with important aspects of neuronal differentiation, such as fate specification and arealization and confer cell type-specific associations to neurodevelopmental disorders. However, studies of the epigenomic landscape of the developing human brain have yet to be performed at single-cell resolution. Here, we profiled chromatin accessibility of >75,000 cells from eight distinct areas of developing human forebrain using single cell ATAC-seq (scATACseq). We identified thousands of loci that undergo extensive cell type-specific changes in accessibility during corticogenesis. Chromatin state profiling also reveals novel distinctions between neural progenitor cells from different cortical areas not seen in transcriptomic profiles and suggests a role for retinoic acid signaling in cortical arealization. Comparison of the cell type-specific chromatin landscape of cerebral organoids to primary developing cortex found that organoids establish broad cell type-specific enhancer accessibility patterns similar to the developing cortex, but lack many putative regulatory elements identified in homologous primary cell types. Together, our results reveal the important contribution of chromatin state to the emerging patterns of cell type diversity and cell fate specification and provide a blueprint for evaluating the fidelity and robustness of cerebral organoids as a model for cortical development."
U01 Kriegstein,kriegstein_sc_10x_proj,kriegstein_sc_10xv2,http://data.nemoarchive.org/biccn/grant/devhu/kriegstein/transcriptome/scell/,CCBY4,10x 3' v2 sequencing,Single-Cell Sequencing of the Developing Human Brain,Single-cell sequencing of a variety of cortical regions and sub-cortical structures from 20 intact first and second trimester brain samples.,10x 3' v2 sequencing,Single-Cell Sequencing of the Developing Human Brain,"The human brain is composed of diverse cell types across brain regions that enable unique capabilities. Within the brain, the cerebral cortex is responsible for a number of cognitive functions and sensory integration, with distinct cortical regions controlling a variety of tasks including motion, vision, speech, and judgment. Recent work exploring the cell types of two distinct cortical regions in the human and mouse suggests that excitatory neurons are area specific and emerge during developmental stages of peak neurogenesis. However, further characterization of cortical arealization is required to understand whether gradients, sharp boundaries, or some combination of patterns describes the areal distribution of neurons and other cortical cell types. Importantly, accurate modeling of cortical development and understanding biological constraints for any attempts at stem cell therapies requires characterizing when neuroepithelia or radial glia transition from a uniform population into areal specific progenitors, and the degree to which they are committed to an areal fate. In order to comprehensively characterize the areal diversity of cell types during human development, we performed single-cell sequencing of a variety of cortical regions and sub-cortical structures from 20 intact first and second trimester brain samples. With over a million cells, we identify hundreds of cells types including temporal and area specific neurons, interneurons and radial glia populations, as well as a number of subtypes from each of these classes that are expressed across most cortical areas. Additionally, we find a small number of subpopulations of neuroepithelial cells and identify several key pathways that may regulate the switch from neuroepithelia to radial glia identity. Together, these datasets suggest a model of both area restricted progenitor populations as well as radial glia cell types that are observed across cortical regions, suggesting an orchestrated interplay of fate determination that gives rise to the required cell diversity of the human cerebral cortex."
U01 Kriegstein,kriegstein_sn_10x_proj,kriegstein_sn_10xv2,http://data.nemoarchive.org/biccn/grant/devhu/kriegstein/transcriptome/sncell/,CCBY4,10x 3' v2 sequencing,Single-Nuclei Sequencing of Late Stages of Human Brain Development and Early Postnatal Life,Single-nucleus RNA sequencing (snRNA-seq) of more than 100 post-mortem human cortical tissue samples from over 50 individuals and three cortical areas.,10x 3' v2 sequencing,Single-Nuclei Sequencing of Late Stages of Human Brain Development and Early Postnatal Life,"Human cortical development spans years of prenatal and postnatal development. This incredibly complex process involves multiple interacting cell lineages and dynamic processes, such as neurogenesis and gliogenesis, neuronal migration, cell differentiation, areal specification, axon outgrowth and synapse formation and maturation. Human cortical development proceeds through a number of critical stages that are believed to be affected in neurodevelopmental and psychiatric diseases, such as autism spectrum disorder and schizophrenia. In order to investigate the dynamic landscape of human cortical development at the single-cell resolution, we utilized single-nucleus RNA sequencing (snRNA-seq) to profile more than 100 post-mortem human cortical tissue samples from over 50 individuals and three cortical areas. We included samples ranging from second and third trimesters of prenatal development though neonatal and early postnatal stages to teenage and early adult years. By using unbiased nuclei isolation coupled with droplet-based single-cell profiling (10x Genomics), we generated over 300,000 single-nucleus transcriptomics profiles. We performed unbiased clustering, marker discovery and trajectory analysis, and were able to discover gene expression programs that underlie generation of subtypes of cortical projection neurons, interneurons and glial cell types, as well as critical process of development, such as generation of astrocytes, axon outgrowth, synapse formation and formation of mature cortical neuronal circuits. By intersecting cell type-specific developmental gene expression profiles with known genetic risk factors of neurodevelopmental disorders, we were able to identify cell types and developmental stages that can be especially affected in autism spectrum disorder and schizophrenia, leading to improper formation and function of specific cortical circuits. Our study sheds light on cell type-specific mechanisms of normal cortical development and cell types and processes affected in common neurodevelopmental disease. In addition, our rich single-nucleus transcriptomic atlas will be of great value to a wide range of neuroscientists."
U01 Lein,human_cortex,human_cortex_SS4_restricted_limited,,AIBSTOU; CCBY4,Controlled RS human ctx RNAseq,Controlled Access RS human cortex RNAseq,"Single cell RNA sequencing data on human nuclei from middle temporal gyrus (MTG), profiled by SMART-seq v4 and consented for use in the study of the brain in health and disease (controlled access) available under Allen Terms of Use.",Human CTX SSv4,Human Multiple Cortical Areas - SMART-seq,"To investigate the cellular diversity across human cortex, we used SMART-Seq v4 single nucleus RNA-sequencing that provides a relatively unbiased survey of cell types and can be applied to neurosurgical and frozen, postmortem tissue. Individual layers of cortex were dissected from brain tissues including the middle temporal gyrus (MTG), anterior cingulate gyrus (CgGr), primary visual cortex (V1C), primary motor cortex (M1C), primary somatosensory cortex (S1C) and primary auditory cortex (A1C), and nuclei were dissociated and sorted using the neuronal marker NeuN. In total, nuclei from MTG were sampled from four postmortem donor brains and four neurosurgical donor brains and nuclei from the remaining regions were sampled from 3 postmortem donor brains. Profiled nuclei included approximately 90% neurons and 10% glia."
U01 Lein,lein_sn_SSv4_proj,lein_sn_SSv4,,,SMART-seq v4,Transcriptomic characterization of cell types in human brain,Deep transcriptomic analysis of hippocampus and dorsolateral prefrontal cortex.,SMART-seq v4,Transcriptomic characterization of cell types in human brain,Deep transcriptomic analysis of hippocampus and dorsolateral prefrontal cortex
U01 Lein,lein_sn_10x,lein_sn_10xv2,http://data.nemoarchive.org/biccn/grant/lein/linnarsson/transcriptome/sncell/10X/,,10x 3' v2 sequencing,Transcriptomic characterization of cell types in human brain,Broad transcriptomic survey of ~100 regions of adult postmortem human brain and spinal cord.,10x 3' v2 sequencing,Transcriptomic characterization of cell types in human brain,Broad transcriptomic survey of ~100 regions of adult postmortem human brain and spinal cord
U01 Lein,human_cortex,human_cortex_SS4_restricted_GRU,,AIBSTOU; CCBY4,Controlled Access General Research Use RNAseq files,Controlled Access General Research Use human cortex RNAseq,"Single cell RNA sequencing data on human nuclei from human cortical areas MTG, M1C, CgGr, V1C, S1C, and A1C, profiled by SMART-seq v4 and consented for general research use (controlled access) available under Allen Terms of Use.",Human CTX SSv4,Human Multiple Cortical Areas - SMART-seq,"To investigate the cellular diversity across human cortex, we used SMART-Seq v4 single nucleus RNA-sequencing that provides a relatively unbiased survey of cell types and can be applied to neurosurgical and frozen, postmortem tissue. Individual layers of cortex were dissected from brain tissues including the middle temporal gyrus (MTG), anterior cingulate gyrus (CgGr), primary visual cortex (V1C), primary motor cortex (M1C), primary somatosensory cortex (S1C) and primary auditory cortex (A1C), and nuclei were dissociated and sorted using the neuronal marker NeuN. In total, nuclei from MTG were sampled from four postmortem donor brains and four neurosurgical donor brains and nuclei from the remaining regions were sampled from 3 postmortem donor brains. Profiled nuclei included approximately 90% neurons and 10% glia."
U01 Lein,lein_sn_10x,lein_sn_10xv3,,,10x 3' v3 sequencing,Transcriptomic characterization of cell types in human brain,Broad transcriptomic survey of ~100 regions of adult postmortem human brain and spinal cord.,10x 3' v2 sequencing,Transcriptomic characterization of cell types in human brain,Broad transcriptomic survey of ~100 regions of adult postmortem human brain and spinal cord
U01 Lein,human_cortex,human_cortex_SS4_counts,https://portal.brain-map.org/atlases-and-data/rnaseq/human-multiple-cortical-areas-smart-seq,AIBSTOU; CCBY4,Human multiple cortical areas gene counts and taxonomy,Human multiple cortical areas gene counts and taxonomy,"Results of analysis of single cell RNAsequencing data from 5 cortical areas including motor cortex, visual cortex, anterior cingulage, medial temporal gyrus, somatosensory and auditory cortex.  Includes gene counts per cell and per cluster, and taxonomy information.",Human CTX SSv4,Human Multiple Cortical Areas - SMART-seq,"To investigate the cellular diversity across human cortex, we used SMART-Seq v4 single nucleus RNA-sequencing that provides a relatively unbiased survey of cell types and can be applied to neurosurgical and frozen, postmortem tissue. Individual layers of cortex were dissected from brain tissues including the middle temporal gyrus (MTG), anterior cingulate gyrus (CgGr), primary visual cortex (V1C), primary motor cortex (M1C), primary somatosensory cortex (S1C) and primary auditory cortex (A1C), and nuclei were dissociated and sorted using the neuronal marker NeuN. In total, nuclei from MTG were sampled from four postmortem donor brains and four neurosurgical donor brains and nuclei from the remaining regions were sampled from 3 postmortem donor brains. Profiled nuclei included approximately 90% neurons and 10% glia."
U01 Lein,human_cortex,human_cortex_SS4_Open_GRU,,AIBSTOU; CCBY4,Open access human cortex RNAseq files,Open access human cortex RNAseq files,"Single cell RNA sequencing data on human nuclei from human cortical areas M1C and DFC, profiled by SMART-seq v4 and consented for open access. This data is available under the Creative Commons - Attribution 4.0 International license (CCBY4).",Human CTX SSv4,Human Multiple Cortical Areas - SMART-seq,"To investigate the cellular diversity across human cortex, we used SMART-Seq v4 single nucleus RNA-sequencing that provides a relatively unbiased survey of cell types and can be applied to neurosurgical and frozen, postmortem tissue. Individual layers of cortex were dissected from brain tissues including the middle temporal gyrus (MTG), anterior cingulate gyrus (CgGr), primary visual cortex (V1C), primary motor cortex (M1C), primary somatosensory cortex (S1C) and primary auditory cortex (A1C), and nuclei were dissociated and sorted using the neuronal marker NeuN. In total, nuclei from MTG were sampled from four postmortem donor brains and four neurosurgical donor brains and nuclei from the remaining regions were sampled from 3 postmortem donor brains. Profiled nuclei included approximately 90% neurons and 10% glia."
U01 Osten,osten_stpt_proj,osten_stpt,http://download.brainimagelibrary.org/biccn/osten/cellcounting/,CCBY4,Serial two photon tomography,Whole Brain Quantitative Cell-Type Atlasing in Adult Male and Female Mouse,Serial two photon tomography of brains of fluorescently labeled cell types.,Serial two photon tomography,Whole Brain Quantitative Cell-Type Atlasing in Adult Male and Female Mouse.,"The stereotyped distribution of brain cell types, their numbers and ratios in all anatomical regions, is a fundamental determinant of brain functions, yet classical stereological methods have been too laborious to allow comprehensive analyses across animals and genders. Here we apply our quantitative brainwide (qBrain) cell-type mapping platform, comprising cell-type labeling, single-cell resolution imaging by serial two-photon tomography (STPT), and automated computational analyses, to map the stereotyped distributions of over thirty neuronal and glia cell types in male and female mouse brain. We discover detailed organizing principles underlying known functions of sensory, motor and cognitive cortical circuitries, as well as over a dozen of sex-dimorphic cell-type distributions primarily in brain structures of the vomeronasal system regulating reproductive and social behaviors. The qBrain atlas provides a unique anatomical resource that can be mined to link stereotyped aspects of neuronal distributions to known and unknown functions of diverse brain areas. "
